<?xml version="1.0" encoding="utf-8"?>
<xs:schema xmlns:xs="http://www.w3.org/2001/XMLSchema">
  <xs:element name="ContextMenu">
    <xs:complexType>
      <xs:sequence>
        <xs:element name="Menu" maxOccurs="unbounded">
          <xs:complexType>
            <xs:sequence>
              <xs:element name="MenuItem" maxOccurs="unbounded">
                <xs:complexType>
                  <xs:sequence>
                    <xs:element name="Key" type="xs:string"/>
                    <xs:element name="Value" type="xs:string"/>
                  </xs:sequence>
                </xs:complexType>
              </xs:element>
            </xs:sequence>
            <xs:attribute name="Category" type="xs:string" use="required"/>
          </xs:complexType>
        </xs:element>
      </xs:sequence>
    </xs:complexType>
  </xs:element>
</xs:schema>
